{
  "schemaVersion": 1,
  "entryId": "extension/handoff",
  "verifiedAgainst": {
    "type": "commit",
    "value": "d6b23a1d2fa2e8a53896916b23d85ede334e9066"
  },
  "reviewedBy": "Vedang Manerikar",
  "reviewedOn": "2026-08-22",
  "claims": [
    {
      "claim": "Registers the handoff command and validates interactive UI, selected model, and goal input.",
      "sourcePath": "pi-extensions/handoff.ts",
      "sourceLines": "95-113"
    },
    {
      "claim": "Delegates generation to the host model registry with abort signaling, disabled cache retention, and a unique session ID.",
      "sourcePath": "pi-extensions/handoff.ts",
      "sourceLines": "152-160"
    },
    {
      "claim": "After the latest compaction, preserves its summary and retained branch entries for handoff context.",
      "sourcePath": "pi-extensions/handoff.ts",
      "sourceLines": "64-93"
    },
    {
      "claim": "With no compaction, preserves every branch entry convertible to a model message for handoff context.",
      "sourcePath": "pi-extensions/handoff.ts",
      "sourceLines": "64-75"
    },
    {
      "claim": "Serializes the resulting branch context and sends it with the requested goal to the configured model.",
      "sourcePath": "pi-extensions/handoff.ts",
      "sourceLines": "118-160"
    },
    {
      "claim": "Lets the user edit the generated prompt before opening a linked replacement session.",
      "sourcePath": "pi-extensions/handoff.ts",
      "sourceLines": "190-211"
    }
  ]
}
